<?xml version="1.0" encoding="UTF-8"?>
<xs:schema xmlns:xs="http://www.w3.org/2001/XMLSchema">
    <xs:element name="escola">
        <xs:complexType>
            <xs:sequence>
                <xs:element name="alumne" maxOccurs="unbounded">
                    <xs:complexType>
                        <xs:sequence>
                            <xs:element name="nom"/>
                            <xs:element name="edat">
                                <xs:simpleType>
                                    <xs:restriction base="xs:integer">
                                        <xs:minInclusive value="3"/>
                                        <xs:maxInclusive value="18"/>
                                    </xs:restriction>
                                </xs:simpleType>
                            </xs:element>
                            <xs:element name="notes">
                                <xs:complexType>
                                    <xs:sequence>
                                        <xs:element name="nota"  maxOccurs="unbounded">
                                            <xs:simpleType>
                                                <xs:restriction base="xs:decimal">
                                                    <xs:minInclusive value="0"/>
                                                    <xs:maxInclusive value="10"/>
                                                </xs:restriction>
                                            </xs:simpleType>
                                        </xs:element>
                                    </xs:sequence>
                                </xs:complexType>
                            </xs:element>
                        </xs:sequence>
                    </xs:complexType>
                </xs:element>
            </xs:sequence>
            <xs:attribute name="nom" type="xs:string" use="required"/>
        </xs:complexType>
    </xs:element>
</xs:schema>
